ticker,sector,lens,role,allocation_pct,price_thb,mcap_b_thb,yield_pct,pe,pbv,roe_pct,de_ratio,dps_streak_years,payout_pct,thesis_short,strength_1,strength_2,strength_3,weakness_1,weakness_2,weakness_3
AMATA,Industrial Estate,Niwes,Anchor,35.0,20.70,23.8,5.31,7.56,1.01,13.84,1.29,6,40.1,Land bank 4-6x mcap + DC catalyst (NTT+THA signed 2025) + 10 hidden businesses,Hidden land bank 4-6x mcap (Niwes Hidden Value Tier A),DC catalyst from NTT + THA contracts signed 2025 - Thai/Vietnam data center boom,EPS positive 15/15 years survived 2011 flood + 2020 COVID + DPS rebuilt x5.5 in 6 years + PE 7.5 PBV 1.0 cheap,D/E 1.29 high for property + net debt rising 3 years straight,Gross Margin trending down 49% to 39% over 5 years (land development cost rising),Stock dropped 28.75 to 16.6 in 2024-2025 (market not pricing DC catalyst yet)
BBL,Banking,Niwes,Anchor,22.5,164.50,314.0,6.08,6.83,0.55,8.15,7.00,5,41.5,Niwes Tier S 5/5 + Float engine 1.2T (Buffett pattern) + Permata ASEAN 10y bet (anchor-grade),Largest Thai bank + scale moat + sticky enterprise client base,P/BV 0.55 = half of book value (historically cheap) + Niwes Tier S binary check 5/5 perfect,EPS positive 16/16 years survived 1997 + 2008 + 2020 + Permata Indonesia 10y growth bet,ROE 8.15% lower than KBANK/SCB peers (10-12%),Cyclical to Thai economy + profit dropped -52% during COVID,Conservative payout 41% (could distribute more)
TCAP,Financial Holding,Niwes,Supporting,12.5,58.75,61.6,5.96,7.55,0.75,10.09,0.80,22,47.4,DPS Hall of Fame (passed 1997/2008/2020 unbroken) + NPA counter-cyclical (supporting position),22 years dividend unbroken (Hall of Fame) - passed 2008 + COVID 2020 - longest streak in portfolio,NPA counter-cyclical business - earns more during economic slowdown (defensive),D/E 0.80 low post-TBANK divestment + 5y avg yield 5.48% stable + ROE 10-12%,Revenue CAGR -4.1% negative (TBANK divestment shrank top line),Niwes Tier C (fits spirit but score lower than Tier S/A peers),Mcap 61B much smaller than BBL (314B) = lower liquidity
TOA,Construction Materials,Hong,Value Anchor,7.5,11.80,24.1,6.36,7.84,1.58,20.7,0.42,1,47.8,Thailand paint #1 + 60 year brand + PEG 0.15 value anchor,Profit new high 12 years (2917 MB in 2025) + Gross Margin recovered 29% to 37.7%,Thailand #1 paint brand + 60-year family business + SuperShield moat,D/E 0.42 strong balance sheet + PEG 0.15 cheapest + Vietnam/Indonesia growth exposure,Revenue stuck at 21-22B for 4 years = mature/saturated business,Vulnerable to raw material swings (plastic + steel) - margin volatile,Gen 3 succession plan unclear (CEO Gen 2 aged 50-60)
SISB,Education,Hong,Moat Growth,7.5,10.10,9.4,5.05,9.87,2.40,26.25,0.56,7,42.0,Singapore international school chain + margin 38% + price -42% from peak,Net Margin 37% extraordinary + ROE 26% + switching cost very high (curriculum + friends lock-in),Singapore international school chain 5 campuses + brand + DPS streak 7 years growing,EEC growth exposure (Rayong pipeline) + price -42% from peak = good entry valuation,Thai birth rate dropped 40% (2015-2024) = TAM shrinking 15 years ahead,IPO 2018 = track record only 8 years still short,Quality teacher shortage + rising wages = long-term margin risk
SECURE,IT Cybersecurity,Hong,Defensive Growth,6.25,11.30,1.16,7.20,9.14,1.44,16.27,0.50,4,53.0,Compliance-driven defensive growth + cash >= short-debt + PEG 0.31,PEG 0.30 cheapest in Hong group + Yield 7.20% highest in Hong portfolio,4 mandatory laws (PDPA + BOT + NCSA + Cyber Act) = compliance moat 2022-2026,Thai cybersecurity market growing 12-15% per year + clean balance sheet + cash buffer,Mcap only 1.16B (listed on mai) = liquidity risk + small float,Growth slowed to 5% in 2025 (down from 16-26% prior) = saturation signal,Vendor concentration not disclosed + IPO 2021 (5y) hasn't faced major crisis
MOSHI,Retail Lifestyle,Hong,Tail Growth,3.75,35.25,11.9,3.46,16.50,3.98,26.53,0.85,3,41.0,Japanese-style retail + DPS grew 12x in 3 years + PEG 0.57 growth catalyst,Net Margin 18.3% extraordinary for retail (industry 2-7%) + ROE 26.5%,Profit new high 5 years straight + DPS grew 12x in 3 years = classic Hong Sweet Spot pattern,Gross Margin 55.8% highest in portfolio + private label + deep China sourcing moat,Yield 3.37% below Hong sweet spot (typically 4-7%) = not income play,Stock dropped 20% in 2025 while NP grew 29% = market suspicious (same-store sales?),IPO 2022 (4y) + format easy to copy (Miniso/Daiso bigger scale)
Cash,Cash,Cash,Dry Powder,5.0,,,,,,,,,,Reserve for catching stocks when price drops >=20% from high AND thesis intact,Available immediately - no opportunity cost lock-up,Earmarked for portfolio stocks only (not new names) = focused deployment,Sized small (5%) so it forces selectivity - only deployed on real conviction events,Idle cash = opportunity cost during normal markets,Discipline required - easy to deploy too early on minor dips,Only 5% means cannot rescue catastrophic drawdown - relies on stock selection
